Title,Price,Rating,Brand,Category,No_of_Customer_Reviews,Availability,Date_of_Extraction
Casio Enticer Analog Dial Watch,"5,995",4.3,Brand: Casio,watches for men casio,"3,876",In stock,30-05-2023
SanDisk Cruzer Blade 64GB USB 2.0 Flash Drive,379,,Visit the SanDisk Store,pendrive,"2,52,744",In stock,30-05-2023
"Bajaj DX-2 600W Dry Iron with Advance Soleplate and Anti-bacterial German Coating Technology, Black",499,,Visit the Bajaj Store,iron under 500,"6,133",In stock,30-05-2023
Boldfit Shoe Bag for Travel & Storage Travel Organizer for Women & Men Travel Accessories Shoe Organizer Shoe Bags Pouches Travel Shoe Cover for Travelling Travel Essentials - Pack of 6 Shoe Pouch,199,,Brand: Boldfit,N/A,"1,335",In stock,30-05-2023
Boldfit Shoe Bag for Travel & Storage Travel Organizer for Women & Men Travel Accessories Shoe Organizer Shoe Bags Pouches Travel Shoe Cover for Travelling Travel Essentials - Pack of 6 Shoe Pouch,199,4.5 out of 5 stars,Brand: Boldfit,N/A,"1,335",In stock,30-05-2023
American Tourister 32 Ltrs Black Casual Backpack (AMT FIZZ SCH BAG 02 - BLACK),"1,199.00",4.0 out of 5 stars,Visit the American Tourister Store,N/A,"54,298",In stock,30-05-2023
Rs.500 Sony PlayStation Network Wallet Top-Up (Email Delivery in 1 hour- Digital Voucher Code),500,4.7 out of 5 stars,Sony Interactive Entertainment Europe,ps wallet top up,"4,681",In stock,30-05-2023
His Definitive Greatest Hits,"1,495",4.7 out of 5 stars,"

Bb King 
(Artist) 
  Format: Audio CD",N/A,945,N/A,30-05-2023
"Konvio Neer Imported Total Dissolved Solids Meter, Water Quality Tester, PPM Tester For Household Drinking Water, Swimming Pools, Aquariums, Hydroponics and more(1)",299,4.4 out of 5 stars,Visit the KONVIO NEER Store,N/A,"29,086",In stock,30-05-2023
"Personal Size Blender, Portable Blender, Battery Powered USB Blender, with Four Blades, Mini Blender Travel Bottle for Juice, Shakes, and Smoothies (Multicolor)",589,Previous page,Sayona Fashio,in Industrial & Scientific,"29,086",In stock,30-05-2023
"Personal Size Blender, Portable Blender, Battery Powered USB Blender, with Four Blades, Mini Blender Travel Bottle for Juice, Shakes, and Smoothies (Multicolor)",589,Previous page,Sayona Fashio,N/A,NaN,In stock,30-05-2023
"TEDSTREE Skin Friendly Ultra Soft 3 Feet Teddy Bear for Kids, Lovable Huggable Cute Soft Giant Teddy Bear for Girlfriends/Wife/Kids -(Pink, 91 cm)",497,3.5 out of 5 stars,Visit the TEDSTREE Store,N/A,"2,102",,30-05-2023
